{
  "proof_type": "runtime-loop-proof",
  "generated_at": "2026-06-15T05:39:21.084Z",
  "request": "初回離脱率を下げたい",
  "routing_mode": "fast-track",
  "provider": "mock",
  "proof_status": "passed",
  "session_ref": ".aof/sessions/SESS-MQES9OAT-79Q9C0.json",
  "decision_refs": [
    ".aof/decisions/DEC-MQES9OAV-9AGNGI.json",
    ".aof/decisions/DEC-MQES9OBC-BJU6QX.json"
  ],
  "allocation_plan_ref": ".aof/artifacts/allocation/plans/APL-MQES9OCA-NK98NS.json",
  "policy_evaluation_ref": ".aof/artifacts/allocation/policy-evaluations/PER-MQES9OCB-MRXTGU.json",
  "resource_claim_ref": ".aof/artifacts/allocation/resource-claims/RCL-MQES9OCC-MXN006.json",
  "role_result_refs": [
    ".aof/artifacts/execution/role-results/RRES-MQES9OCD-W57VE1.json",
    ".aof/artifacts/execution/role-results/RRES-MQES9OCE-5HXTD0.json"
  ],
  "role_join_ref": ".aof/artifacts/execution/role-joins/RJOIN-MQES9OCE-Q1HT75.json",
  "team_output_ref": ".aof/artifacts/execution/team-outputs/TOUT-MQES9OCF-4V93TD.json",
  "council_review_ref": ".aof/artifacts/execution/council-reviews/CREV-MQES9OCG-9GV250.json",
  "execution_lineage_ref": ".aof/context/active/execution-lineage.json",
  "learning_loop_ref": ".aof/context/active/learning-loop.json",
  "phases": {
    "framing": "completed",
    "allocation": "allowed",
    "execution": "ready-for-orchestrator-decision",
    "review": "approved",
    "outcome": "success",
    "next_step_recommendation": "Expand the same auditable loop shape across additional backend families without changing the contract layer."
  },
  "notes": [
    "planning execution status: completed",
    "approval outcome status: approved",
    "learning loop basis: framework-self-audit"
  ]
}
